{
  "$schema": "./app-config.schema.json",
  "version": "2.0.0",
  "lastUpdated": "2024-01-01T00:00:00.000Z",
  "description": "WebMacOS 应用配置文件",
  "system": {
    "system_about": {
      "key": "system_about",
      "system": true,
      "essential": false,
      "singleton": true,
      "component": "SystemAbout",
      "title": "关于本站",
      "icon": "icon-question",
      "iconColor": "#fff",
      "iconBgColor": "#23282d",
      "width": 480,
      "height": 250,
      "resizable": false,
      "hideInDesktop": true,
      "category": "system",
      "description": "显示系统信息和版本详情",
      "version": "1.0.0",
      "author": "System"
    },
    "system_finder": {
      "key": "system_finder",
      "system": true,
      "essential": true,
      "singleton": false,
      "component": "SystemFinder",
      "title": "访达",
      "icon": "icon-MIS_chanpinshezhi",
      "iconColor": "#fff",
      "iconBgColor": "#db5048",
      "width": 800,
      "height": 600,
      "keepInDock": true,
      "category": "system",
      "description": "文件管理器，用于浏览和管理文件",
      "version": "1.0.0",
      "author": "System",
      "permissions": ["filesystem"]
    },
    "system_launchpad": {
      "key": "system_launchpad",
      "system": true,
      "essential": true,
      "singleton": true,
      "component": "SystemLaunchPad",
      "title": "启动台",
      "icon": "icon-shezhi",
      "iconColor": "#333",
      "iconBgColor": "#d4dbef",
      "width": 500,
      "height": 300,
      "hideInDesktop": true,
      "keepInDock": true,
      "category": "system",
      "description": "应用程序启动器",
      "version": "1.0.0",
      "author": "System"
    },
    "system_setting": {
      "key": "system_setting",
      "system": true,
      "essential": true,
      "singleton": true,
      "component": "SystemSetting",
      "title": "系统偏好设置",
      "icon": "icon-setting",
      "iconColor": "#fff",
      "iconBgColor": "#23282d",
      "width": 800,
      "height": 600,
      "resizable": false,
      "keepInDock": true,
      "category": "system",
      "description": "系统设置和配置",
      "version": "1.0.0",
      "author": "System",
      "permissions": ["system", "storage"]
    },
    "system_store": {
      "key": "system_store",
      "system": true,
      "essential": false,
      "singleton": true,
      "component": "SystemStore",
      "title": "App Store",
      "icon": "icon-store",
      "iconColor": "#fff",
      "iconBgColor": "#23282d",
      "width": 800,
      "height": 600,
      "resizable": false,
      "keepInDock": true,
      "category": "system",
      "description": "应用程序商店",
      "version": "1.0.0",
      "author": "System",
      "permissions": ["network"]
    },
    "system_task": {
      "key": "system_task",
      "system": true,
      "essential": false,
      "singleton": true,
      "component": "SystemTask",
      "title": "强制退出",
      "icon": "icon-task",
      "iconColor": "#fff",
      "iconBgColor": "#ff6b6b",
      "width": 640,
      "height": 400,
      "resizable": false,
      "hideInDesktop": true,
      "category": "system",
      "description": "强制退出应用程序",
      "version": "1.0.0",
      "author": "System",
      "permissions": ["system"]
    },
    "composables_test": {
      "key": "composables_test",
      "system": true,
      "essential": false,
      "singleton": false,
      "component": "ComposablesTest",
      "title": "Composables Test",
      "icon": "🧪",
      "iconColor": "#fff",
      "iconBgColor": "#4CAF50",
      "width": 800,
      "height": 600,
      "hideInDesktop": false,
      "category": "development",
      "description": "测试和演示组合式函数功能",
      "version": "1.0.0",
      "author": "Developer",
      "tags": ["test", "composables", "vue"]
    },
    "system_config_manager": {
      "key": "system_config_manager",
      "system": true,
      "essential": false,
      "singleton": true,
      "component": "ConfigManager",
      "title": "配置管理器",
      "icon": "⚙️",
      "iconColor": "#fff",
      "iconBgColor": "#FF9500",
      "width": 1200,
      "height": 800,
      "resizable": true,
      "hideInDesktop": false,
      "keepInDock": false,
      "category": "system",
      "description": "应用配置管理和可视化工具",
      "version": "1.0.0",
      "author": "System",
      "permissions": ["system", "storage"],
      "tags": ["config", "management", "admin"]
    }
  },
  "demo": {
    "demo_demo": {
      "key": "demo_demo",
      "demo": true,
      "featured": true,
      "component": "Demo",
      "title": "DEMO",
      "icon": "icon-MIS_chanpinshezhi",
      "iconColor": "#fff",
      "iconBgColor": "#db5048",
      "width": 600,
      "height": 400,
      "keepInDock": true,
      "category": "entertainment",
      "description": "基础功能演示应用",
      "version": "1.0.0",
      "author": "Demo Team",
      "tags": ["demo", "showcase"]
    },
    "demo_github": {
      "key": "demo_github",
      "demo": true,
      "featured": true,
      "outLink": true,
      "title": "GitHub 仓库",
      "icon": "icon-github",
      "iconColor": "rgb(36,41,46)",
      "iconBgColor": "#eee",
      "url": "https://github.com/HammCn/MacOS-Web-UI",
      "target": "_blank",
      "keepInDock": true,
      "category": "development",
      "description": "项目 GitHub 仓库",
      "version": "1.0.0",
      "author": "GitHub"
    },
    "demo_gitee": {
      "key": "demo_gitee",
      "demo": true,
      "featured": true,
      "outLink": true,
      "title": "Gitee 仓库",
      "icon": "icon-gitee",
      "iconColor": "#fff",
      "iconBgColor": "rgb(199,29,35)",
      "url": "https://gitee.com/hamm/mac-ui",
      "target": "_blank",
      "keepInDock": true,
      "category": "development",
      "description": "项目 Gitee 仓库",
      "version": "1.0.0",
      "author": "Gitee"
    },
    "demo_camera": {
      "key": "demo_camera",
      "demo": true,
      "featured": true,
      "component": "DemoCamera",
      "title": "Photo Booth",
      "icon": "icon-camera1",
      "iconColor": "#fff",
      "iconBgColor": "#E24637",
      "width": 540,
      "height": 540,
      "resizable": false,
      "category": "graphics",
      "description": "相机拍照应用演示",
      "version": "1.0.0",
      "author": "Demo Team",
      "permissions": ["camera"]
    }
  },
  "user": {},
  "defaults": {
    "width": 640,
    "height": 480,
    "minWidth": 320,
    "minHeight": 240,
    "resizable": true,
    "draggable": true,
    "closable": true,
    "minimizable": true,
    "maximizable": true,
    "alwaysOnTop": false,
    "modal": false,
    "transparent": false,
    "frame": true,
    "titleBarStyle": "default",
    "backgroundColor": "#ffffff",
    "opacity": 1,
    "shadow": true,
    "animation": true,
    "keepInDock": false,
    "hideInDesktop": false,
    "hideWhenClose": false,
    "disableResize": false,
    "autoFocus": true,
    "category": "other",
    "version": "1.0.0",
    "author": "Unknown"
  }
}